"Name","Type","Min","Max","Default","Description","Example"
"Condom_Usage_Parameters_Type","enum","NA","NA","USE_DEFAULT","Indicates if the relationship should use the **Condom_Usage_Probablility** for the relationship type as defined in the Demographics file ('USE_DEFAULT') or specify usage sigmoid parameters for this specific relationship ('SPECIFY_USAGE').","[link](../json/campaign-startnewrelationship_condom_usage_parameters_type.json)"
"Condom_Usage_Sigmoid","json object","NA","NA","NA","The new sigmoid to use when determining the probability that a condom is used during a coital act within the specified relationship. This overrides the **Condom_Usage_Probablility** for the relationship type as defined in the Demographics file.","[link](../json/campaign-startnewrelationship_condom_usage_sigmoid.json)"
"Disqualifying_Properties","array of strings","NA","NA","""""","A list of **IndividualProperty** key:value pairs that will prevent an intervention from being distributed or applied/updated. See :ref:`demo-properties` parameters for more information. Generally used to control the flow of health care access. For example, to prevent the same individual from accessing health care via two different routes at the same time.","[link](../json/campaign-startnewrelationship_disqualifying_properties.json)"
"Dont_Allow_Duplicates","boolean","0","1","0","If an individual's container has an intervention, set to true (1) to prevent them from receiving another copy of the intervention. Supported by all intervention classes.","[link](../json/campaign-startnewrelationship_dont_allow_duplicates.json)"
"Intervention_Name","string","NA","NA","StartNewRelationship","The optional name used to refer to this intervention as a means to differentiate it from others that use the same class.","[link](../json/campaign-startnewrelationship_intervention_name.json)"
"New_Property_Value","string","NA","NA","""""","An optional **IndividualProperty** key:value pair that will be assigned when the intervention is distributed. See :ref:`demo-properties` parameters for more information. Generally used to indicate the broad category of health care cascade to which an intervention belongs to prevent individuals from accessing care through multiple pathways. For example, if an individual must already be taking a particular medication to be prescribed a new one. ","[link](../json/campaign-startnewrelationship_new_property_value.json)"
"Partner_Has_IP","string","NA","NA","""""","The **IndividualProperty** key:value pair that the potential partner must have. Empty string implies no filtering. See :ref:`demo-properties` parameters for more information.","[link](../json/campaign-startnewrelationship_partner_has_ip.json)"
"Relationship_Created_Event","string","NA","NA","""""","The event trigger to broadcast when a new relationship is created due to the intervention. See :doc:`parameter-campaign-event-list` for possible values. Custom events can be distributed if they are defined in the config parameter **Custom_Individual_Events**.","[link](../json/campaign-startnewrelationship_relationship_created_event.json)"
"Relationship_Type","enum","NA","NA","TRANSITORY","The type of the relationship to start for this person. Possible values are:

* TRANSITORY
* INFORMAL
* MARITAL
* COMMERCIAL","[link](../json/campaign-startnewrelationship_relationship_type.json)"
