"Name","Example","Type","Min","Max","Default","Description"
"Cost_To_Consumer","[link](../json/campaign-hivdrawblood_cost_to_consumer.json)","float","0","3.40282e+38","1","The unit 'cost' assigned to the diagnostic. Setting **Cost_To_Consumer** to zero for all other interventions, and to a non-zero amount for one intervention, provides a convenient way to track the number of times the intervention has been applied in a simulation."
"Disqualifying_Properties","[link](../json/campaign-hivdrawblood_disqualifying_properties.json)","array of strings","NA","NA","[]","A list of **IndividualProperty** key:value pairs that cause an intervention to be aborted (persistent interventions will stop being distributed to individuals with these values). See :ref:`demo-properties` parameters for more information. Generally used to control the flow of health care access. For example, to prevent the same individual from accessing health care via two different routes at the same time."
"Dont_Allow_Duplicates","[link](../json/campaign-hivdrawblood_dont_allow_duplicates.json)","boolean","0","1","0","If an individual's container has an intervention, set to true (1) to prevent them from receiving another copy of the intervention. Supported by all intervention classes."
"Intervention_Name","[link](../json/campaign-hivdrawblood_intervention_name.json)","string","NA","NA","HIVDrawBlood","The optional name used to refer to this intervention as a means to differentiate it from others that use the same class."
"New_Property_Value","[link](../json/campaign-hivdrawblood_new_property_value.json)","string","NA","NA","""""","An optional **IndividualProperty** key:value pair that will be assigned when the intervention is applied. See :ref:`demo-properties` parameters for more information. Generally used to indicate the broad category of health care cascade to which an intervention belongs to prevent individuals from accessing care through multiple pathways. For example, if an individual must already be taking a particular medication to be prescribed a new one."
"Positive_Diagnosis_Event","[link](../json/campaign-hivdrawblood_positive_diagnosis_event.json)","enum","NA","NA","""""","If the test is positive, this specifies an event that can trigger another intervention when the event occurs. See :doc:`parameter-campaign-event-list` for possible values."
