"Name","Type","Min","Max","Default","Description","Example"
"Disqualifying_Properties","array of strings","NA","NA","[]","A list of **NodeProperty** key:value pairs that cause an intervention to be aborted (persistent interventions will stop being distributed to individuals with these values). See :ref:`demo-properties` parameters for more information. Generally used to control the flow of health care access. For example, to prevent the same individual from accessing health care via two different routes at the same time.","[link](../json/campaign-multinodeinterventiondistributor_disqualifying_properties.json)"
"Dont_Allow_Duplicates","boolean","0","1","0","If an individual's container has an intervention, set to true (1) to prevent them from receiving another copy of the intervention. Supported by all intervention classes.","[link](../json/campaign-multinodeinterventiondistributor_dont_allow_duplicates.json)"
"Intervention_Name","string","NA","NA","MultiNodeInterventionDistributor","The optional name used to refer to this intervention as a means to differentiate it from others that use the same class.","[link](../json/campaign-multinodeinterventiondistributor_intervention_name.json)"
"New_Property_Value","string","NA","NA","""""","An optional **NodeProperty** key:value pair that will be assigned when the intervention is applied. See :ref:`demo-properties` parameters for more information.","[link](../json/campaign-multinodeinterventiondistributor_new_property_value.json)"
"Node_Intervention_List","array of json objects","NA","NA","NA","A list of nested JSON objects for the multi-node-level interventions to be distributed by this intervention.","[link](../json/campaign-multinodeinterventiondistributor_node_intervention_list.json)"
